{
  "$schema": "https://json-schema.org/draft/2020-12/schema",
  "$id": "https://e2e.dev/schema/session-v1.schema.json",
  "title": "e2e session-1",
  "type": "object",
  "additionalProperties": false,
  "required": ["schemaVersion", "runId", "name", "targetId", "platform", "backend", "appIdentity", "createdAt", "expiresAt", "state"],
  "properties": {
    "schemaVersion": { "const": "session-1" },
    "runId": { "$ref": "#/$defs/uuidV7" },
    "name": { "type": "string", "pattern": "^[A-Za-z0-9_.-]{1,128}$" },
    "targetId": { "type": "string", "minLength": 1, "maxLength": 128 },
    "platform": { "type": "string", "minLength": 1, "maxLength": 128 },
    "backend": {
      "type": "object",
      "additionalProperties": false,
      "required": ["name", "version", "spiVersion"],
      "properties": {
        "name": { "type": "string", "minLength": 1, "maxLength": 256 },
        "version": { "type": "string", "minLength": 1, "maxLength": 128 },
        "spiVersion": { "const": 1 }
      }
    },
    "appIdentity": { "type": "string", "pattern": "^[a-f0-9]{64}$" },
    "createdAt": { "$ref": "#/$defs/timestamp" },
    "expiresAt": { "$ref": "#/$defs/timestamp" },
    "state": {
      "type": "object",
      "additionalProperties": false,
      "required": ["format", "version", "algorithm", "iv", "tag", "ciphertext"],
      "properties": {
        "format": { "type": "string", "minLength": 1, "maxLength": 128 },
        "version": { "type": "integer", "minimum": 1 },
        "algorithm": { "const": "A256GCM" },
        "iv": { "type": "string", "pattern": "^[A-Za-z0-9+/]{16}$" },
        "tag": { "type": "string", "pattern": "^[A-Za-z0-9+/]{22}==$" },
        "ciphertext": {
          "allOf": [
            { "$ref": "#/$defs/base64" },
            { "type": "string", "minLength": 4, "maxLength": 89478488 }
          ]
        }
      }
    },
    "extensions": {
      "type": "object",
      "maxProperties": 64,
      "propertyNames": {
        "type": "string",
        "maxLength": 128,
        "pattern": "^(?:[a-z0-9]+(?:[.-][a-z0-9]+)+|@[a-z0-9][a-z0-9._-]*/[a-z0-9][a-z0-9._-]*)$"
      },
      "additionalProperties": true
    }
  },
  "$defs": {
    "timestamp": {
      "type": "string",
      "pattern": "^[0-9]{4}-[0-9]{2}-[0-9]{2}T[0-9]{2}:[0-9]{2}:[0-9]{2}\\.[0-9]{3}Z$",
      "format": "date-time"
    },
    "uuidV7": {
      "type": "string",
      "pattern": "^[0-9a-f]{8}-[0-9a-f]{4}-7[0-9a-f]{3}-[89ab][0-9a-f]{3}-[0-9a-f]{12}$"
    },
    "base64": {
      "type": "string",
      "pattern": "^(?:[A-Za-z0-9+/]{4})*(?:[A-Za-z0-9+/]{2}==|[A-Za-z0-9+/]{3}=)?$"
    }
  }
}
