{
  "schemaVersion": "session-1",
  "runId": "018f0f5c-7b2a-7abc-8abc-0123456789ab",
  "name": "member",
  "targetId": "web",
  "platform": "web",
  "backend": {
    "name": "playwright",
    "version": "1.0.0",
    "spiVersion": 1
  },
  "appIdentity": "0000000000000000000000000000000000000000000000000000000000000000",
  "createdAt": "2026-07-24T12:00:00.000Z",
  "expiresAt": "2026-07-24T13:00:00.000Z",
  "state": {
    "format": "playwright-state",
    "version": 1,
    "algorithm": "A256GCM",
    "iv": "AAAAAAAAAAAAAAAA",
    "tag": "AAAAAAAAAAAAAAAAAAAAAA==",
    "ciphertext": "AQIDBA=="
  }
}
